{"schemaVersion":"atlas-canonical-work-decomposition-v1","decompositionId":"road-ltl-1.4__LTL-01__P6.1-V1__RECONSTRUCTED-R1-2026-09-14","contractVersion":"1.0.0","status":"DRAFT","daughterModule":"road-ltl","daughterVersion":"1.4","sourceTaskId":"LTL-01","sourceTaskTitle":"Resolve service demand and execution eligibility","executionReadinessStatus":"RECONSTRUCTED_CANDIDATE_AWAITING_INDEPENDENT_QA","semanticLineage":{"semanticSourceVersion":"1.4","effectiveModuleVersion":"1.5","inheritance":"INHERITED_UNCHANGED_FROM_FROZEN_1.4"},"parentLink":{"parentLevel":"A5","parentTaskId":"LTL-01"},"stopCriterion":"Apply frozen recovered CR1–CR11: decompose only on explicit source-supported information/gate/action/evidence contracts; fail closed on unresolved client binding; stop when terminal semantics are sufficient without undocumented operational knowledge.","workUnits":[{"workUnitId":"WD-LTL01-R1-ROOT","parentWorkUnitId":null,"sequence":1,"unitType":"TASK_ROOT","name":"Resolve service demand and execution eligibility","purpose":"Determine whether governed Road LTL demand is eligible and create/reject the service request with traceable evidence.","sourceRefs":["M","O","C","B","K","E","F"],"executorReadiness":{"status":"NEEDS_DECOMPOSITION","blockingReasons":[],"requiredClientBindings":[],"requiredKnowledgeGaps":[],"downstreamCompilationTarget":"CANONICAL_WORKDEFINITION"},"trigger":"Approved order, replenishment demand or service request exists.","outputState":["SERVICE_REQUEST_ELIGIBLE","SERVICE_REQUEST_CONDITIONAL","SERVICE_REQUEST_REJECTED","HOLD_OR_EXCEPTION"]},{"workUnitId":"WD-LTL01-R1-INFO","parentWorkUnitId":"WD-LTL01-R1-ROOT","sequence":1,"unitType":"ACTION_GROUP","name":"Resolve required request information","purpose":"Resolve the governed information required before eligibility evaluation.","sourceRefs":["M","O"],"executorReadiness":{"status":"NEEDS_DECOMPOSITION","blockingReasons":[],"requiredClientBindings":[],"requiredKnowledgeGaps":[],"downstreamCompilationTarget":"CANONICAL_WORKDEFINITION"}},{"workUnitId":"WD-LTL01-R1-GATES","parentWorkUnitId":"WD-LTL01-R1-ROOT","sequence":2,"unitType":"ACTION_GROUP","name":"Evaluate eligibility gates","purpose":"Apply the explicit completeness, serviceability, conditions and time-window eligibility controls.","sourceRefs":["M","O","B"],"executorReadiness":{"status":"NEEDS_DECOMPOSITION","blockingReasons":[],"requiredClientBindings":[],"requiredKnowledgeGaps":[],"downstreamCompilationTarget":"CANONICAL_WORKDEFINITION"}},{"workUnitId":"WD-LTL01-R1-OUTCOME","parentWorkUnitId":"WD-LTL01-R1-ROOT","sequence":4,"unitType":"ACTION_GROUP","name":"Commit eligibility outcome and evidence","purpose":"Apply the governed action after gate evaluation and retain required execution evidence.","sourceRefs":["M","O"],"executorReadiness":{"status":"NEEDS_DECOMPOSITION","blockingReasons":[],"requiredClientBindings":[],"requiredKnowledgeGaps":[],"downstreamCompilationTarget":"CANONICAL_WORKDEFINITION"}},{"workUnitId":"WD-LTL01-R1-I01","parentWorkUnitId":"WD-LTL01-R1-INFO","sequence":1,"unitType":"INFORMATION_RESOLUTION","name":"Resolve transport service request","purpose":"Validate unique request identity, current version and authenticated requester.","sourceRefs":["M","O"],"executorReadiness":{"status":"EXECUTOR_READY","blockingReasons":[],"requiredClientBindings":[],"requiredKnowledgeGaps":[],"downstreamCompilationTarget":"CANONICAL_WORKDEFINITION"},"trigger":"Transport demand is raised.","atomicActions":["Resolve the transport service request as the governed object on which eligibility is decided; verify unique identity, current version and requester authentication."],"evidenceRequirements":["Resolved service-request identity/version/authentication evidence.","CR10 authority materiality: NOT_MATERIAL — this is deterministic information resolution and does not exercise service eligibility or override authority."],"outputState":"Governed transport service request is resolved for eligibility evaluation."},{"workUnitId":"WD-LTL01-R1-I02","parentWorkUnitId":"WD-LTL01-R1-INFO","sequence":2,"unitType":"INFORMATION_RESOLUTION","name":"Resolve shipper and consignee parties","purpose":"Resolve shipper/consignee identities to authoritative party master records.","sourceRefs":["M","O"],"executorReadiness":{"status":"EXECUTOR_READY","blockingReasons":[],"requiredClientBindings":[],"requiredKnowledgeGaps":[],"downstreamCompilationTarget":"CANONICAL_WORKDEFINITION"},"trigger":"Before service commitment.","atomicActions":["Resolve shipper and consignee party identities to authoritative party master records."],"evidenceRequirements":["Party-master resolution evidence.","CR10 authority materiality: NOT_MATERIAL — this resolves party identity only; it does not decide service eligibility or contractual authority."],"outputState":"Required shipper/consignee parties are resolved."},{"workUnitId":"WD-LTL01-R1-I03","parentWorkUnitId":"WD-LTL01-R1-INFO","sequence":3,"unitType":"INFORMATION_RESOLUTION","name":"Resolve origin and destination locations","purpose":"Resolve origin/destination to authoritative location master and geography.","sourceRefs":["M","O"],"executorReadiness":{"status":"EXECUTOR_READY","blockingReasons":[],"requiredClientBindings":[],"requiredKnowledgeGaps":[],"downstreamCompilationTarget":"CANONICAL_WORKDEFINITION"},"trigger":"Before eligibility is decided.","atomicActions":["Resolve origin and destination locations to authoritative location master/geography."],"evidenceRequirements":["Location-master/geography resolution evidence.","CR10 authority materiality: NOT_MATERIAL — this resolves governed places and does not exercise serviceability decision authority."],"outputState":"Governed origin/destination locations are resolved."},{"workUnitId":"WD-LTL01-R1-I04","parentWorkUnitId":"WD-LTL01-R1-INFO","sequence":4,"unitType":"INFORMATION_RESOLUTION","name":"Resolve cargo profile","purpose":"Resolve description, package/handling-unit count, weight/dimensions where required, and special conditions.","sourceRefs":["M","O"],"executorReadiness":{"status":"EXECUTOR_READY","blockingReasons":[],"requiredClientBindings":[],"requiredKnowledgeGaps":[],"downstreamCompilationTarget":"CANONICAL_WORKDEFINITION"},"trigger":"For every service request.","atomicActions":["Resolve cargo profile from transaction evidence including description, handling/package counts, weight/dimensions where required and special conditions."],"evidenceRequirements":["Cargo-profile transaction evidence.","CR10 authority materiality: NOT_MATERIAL — this resolves cargo facts only; prohibited/special-condition eligibility is evaluated later by a governed gate."],"outputState":"Cargo profile is resolved for eligibility evaluation."},{"workUnitId":"WD-LTL01-R1-I05","parentWorkUnitId":"WD-LTL01-R1-INFO","sequence":5,"unitType":"INFORMATION_RESOLUTION","name":"Resolve commodity/freight classification context","purpose":"Resolve the applicable commodity/freight classification reference under the governing scheme/version when required.","sourceRefs":["M","O"],"executorReadiness":{"status":"BLOCKED_BY_CLIENT_BINDING","blockingReasons":["RequiredInformation LTL-01::REQ::05 explicitly marks clientBindingRequired=true; the applicable commercial/regulatory classification scheme/version is context-dependent."],"requiredClientBindings":["LTL-01::REQ::05"],"requiredKnowledgeGaps":[],"downstreamCompilationTarget":"CANONICAL_WORKDEFINITION"}},{"workUnitId":"WD-LTL01-R1-I06","parentWorkUnitId":"WD-LTL01-R1-INFO","sequence":6,"unitType":"INFORMATION_RESOLUTION","name":"Resolve allowed service and lane serviceability context","purpose":"Resolve the effective-dated service catalogue/lane matrix applicable to the request.","sourceRefs":["M","O","B"],"executorReadiness":{"status":"BLOCKED_BY_CLIENT_BINDING","blockingReasons":["Actual service catalogue/lane matrix is client/carrier network master data."],"requiredClientBindings":["CB::LTL-01::01"],"requiredKnowledgeGaps":[],"downstreamCompilationTarget":"CANONICAL_WORKDEFINITION"}},{"workUnitId":"WD-LTL01-R1-I07","parentWorkUnitId":"WD-LTL01-R1-INFO","sequence":7,"unitType":"INFORMATION_RESOLUTION","name":"Resolve booking/pickup cut-off policy","purpose":"Resolve the timezone-aware effective booking/pickup cut-off policy for time-sensitive requested service dates.","sourceRefs":["M","O","B"],"executorReadiness":{"status":"BLOCKED_BY_CLIENT_BINDING","blockingReasons":["Actual cut-off values and scope are client/carrier parameters or contract values."],"requiredClientBindings":["CB::LTL-01::02"],"requiredKnowledgeGaps":[],"downstreamCompilationTarget":"CANONICAL_WORKDEFINITION"}},{"workUnitId":"WD-LTL01-R1-I08","parentWorkUnitId":"WD-LTL01-R1-INFO","sequence":8,"unitType":"INFORMATION_RESOLUTION","name":"Resolve commercial contract/service entitlement context","purpose":"Resolve the active/effective contract, tariff or commercial entitlement applicable to the account/lane/service/date.","sourceRefs":["M","O","B"],"executorReadiness":{"status":"BLOCKED_BY_CLIENT_BINDING","blockingReasons":["Actual contract/service entitlements are client/carrier commercial bindings."],"requiredClientBindings":["CB::LTL-01::05"],"requiredKnowledgeGaps":[],"downstreamCompilationTarget":"CANONICAL_WORKDEFINITION"}},{"workUnitId":"WD-LTL01-R1-G01","parentWorkUnitId":"WD-LTL01-R1-GATES","sequence":1,"unitType":"DECISION_GATE","name":"Evaluate request completeness","purpose":"Check whether required parties, locations, cargo profile and requested service/date exist before eligibility evaluation.","sourceRefs":["O","M"],"executorReadiness":{"status":"EXECUTOR_READY","blockingReasons":[],"requiredClientBindings":[],"requiredKnowledgeGaps":[],"downstreamCompilationTarget":"CANONICAL_WORKDEFINITION"},"trigger":"Eligibility evaluation begins.","decisionGates":["PASS when required parties, locations, cargo profile and requested service/date exist; FAIL routes to request correction/HOLD_OR_EXCEPTION."],"branchTransitions":["PASS → continue el